{
  "schema_version": "1.0",
  "purpose": "Machine-readable, source-traced extraction of confirmed SIA 4010 test-specification inputs. This is an implementation contract, not a claim that every referenced ISO/SIA dependency or VE binding is complete.",
  "claim_guardrail": "Only values explicitly present in the supplied official test specifications are recorded as confirmed. Referenced standards, schedules, drawings, workbooks, graphs and product curves remain explicit dependencies.",
  "common": {
    "location": {
      "value": "Zürich Kloten",
      "status": "CONFIRMED_NORMATIVE",
      "source": "SIA 4010 Test specifications 2-7",
      "units": "text"
    },
    "climate": {
      "value": "SIA 2028 DRY normal, Zürich Kloten",
      "status": "CONFIRMED_NORMATIVE",
      "source": "SIA 4010 Test specifications 2-7",
      "units": "dataset identity"
    },
    "simulation_period": {
      "value": "2022-01-01 through 2022-12-31",
      "status": "CONFIRMED_NORMATIVE",
      "source": "SIA 4010 Test specifications 2-7",
      "units": "inclusive dates"
    },
    "unresolved_dependencies": [
      "Exact authorized SIA 2028 DRY normal weather file and VE conversion/assignment",
      "Referenced SIA 2024 use schedules and annual simultaneity factors",
      "Referenced ISO 52016:2017 Chapter 7 test-cell inputs where applicable"
    ]
  },
  "tests": {
    "2": {
      "variants": ["2A", "2B", "2C", "2D"],
      "source": "SIA_4010_geteilter_Link/Test2/Spezifikation_Test2.pdf",
      "source_pages": [1, 2],
      "confirmed_inputs": {
        "geometry_reference": "ISO EN 52016:2017 Chapter 7 / ASHRAE 140 test room, south-facing, 48 m2",
        "construction": "Lightweight",
        "use_category": "SIA 2024:2021 3.1 Einzel-Gruppenbüro, standard values",
        "infiltration_m3_h_m2": 0.15,
        "heating_setpoint_c": 20.0,
        "cooling_setpoint_c": 27.0,
        "people_count": 3.43,
        "area_m2_per_person": 14.0,
        "activity_met": 1.2,
        "equipment_gain_w_m2": 11.0,
        "lighting_gain_w_m2": 12.5,
        "lighting_installed_power_w_m2": 12.5,
        "glazing_type": "SGG Planitherm XN_4/14/4/14/4",
        "glazing_g_value": 0.545,
        "glazing_u_w_m2k": 0.654,
        "glazing_visible_transmittance": 0.742,
        "glazing_visible_reflectance": 0.145,
        "external_shading_activation_w_m2": 150.0,
        "variant_2A_shade": "Soltis 92-2048-Alu fabric awning",
        "variant_2A_combined_g_total": 0.059,
        "variant_2A_direct_solar_transmittance": 0.04,
        "variant_2A_outside_solar_reflectance": 0.49,
        "variant_2A_inside_solar_reflectance": 0.456,
        "variant_2A_visible_transmittance": 0.058,
        "variant_2A_outside_visible_reflectance": 0.496,
        "variant_2A_inside_visible_reflectance": 0.395,
        "variant_2A_convection_factor": 0.006,
        "variant_2A_thermal_radiation_factor": 0.013,
        "variant_2A_ventilation_factor": 0.0,
        "variant_2A_secondary_internal_heat_transfer_factor": 0.019,
        "variant_2A_uv_transmittance": 0.012,
        "variant_2A_reference_combined_g_total": 0.056,
        "variant_2A_reference_u_w_m2k": 0.574,
        "variant_2A_iso15099_winter_u_w_m2k": 0.582,
        "variant_2A_peripheral_gap_m": 0.01,
        "variant_2A_screen_layer_thickness_m": 0.0005,
        "variants_2B_2D_shade": "Slat Metal B (WIN7), SIA 387/4:2017 Table 9 control function types 1-3",
        "slat_working_angle_deg": 45.0,
        "slat_visible_transmittance_limit": 0.0,
        "slat_beam_visible_transmittance_at_45": 0.07,
        "slat_diffuse_visible_transmittance_at_45": 0.39,
        "slat_visible_reflectance": 0.5,
        "slat_beam_visible_reflectance_at_45": 0.36,
        "slat_diffuse_visible_reflectance_at_45": 0.21
      },
      "required_results": [
        "hourly total room solar heat gain",
        "hourly transmitted solar radiation excluding secondary heat gains"
      ],
      "mandatory_criteria": [
        "annual sum within the official reference-program band for either permitted solar quantity",
        "hourly frequency distribution within the official reference-program scatter band"
      ],
      "unresolved_dependencies": [
        "ISO EN 52016:2017 Chapter 7 complete test-room input set",
        "SIA 2024:2021 exact schedules and annual simultaneity",
        "SIA 387/4:2017 Table 9 exact control algorithms for types 1-3",
        "Test 2A exact irradiance signal, comparison operator, release rule and timestep state handling; the supplied PDF confirms only an irradiance-threshold control and the 150 W/m2 activation value",
        "Qualified VE dynamic-shading actuator and hourly APS bindings"
      ],
      "ve_generation_status": "NOT_IMPLEMENTED"
    },
    "3": {
      "variants": ["3A", "3B", "3C", "3D", "3E", "3F", "3G", "3H", "3I", "3J", "3K", "3L"],
      "source": "SIA_4010_geteilter_Link/Test3/Spezifikation_Test3.pdf",
      "source_pages": [1, 2, 3],
      "confirmed_inputs": {
        "geometry_reference": "ISO EN 52016:2017 Chapter 7 / ASHRAE 140 test room, south-facing, 48 m2",
        "construction": "Lightweight",
        "use_category": "SIA 2024:2021 3.1 Einzel-Gruppenbüro, standard values",
        "infiltration": "none",
        "heating_setpoint_c": 20.0,
        "cooling_setpoint_c": 27.0,
        "people_count": 3.43,
        "area_m2_per_person": 14.0,
        "activity_met": 1.2,
        "equipment_gain_w_m2": 11.0,
        "lighting_gain_w_m2": 12.5,
        "lighting_annual_simultaneity": 0.8,
        "ceiling_wall_floor_reflectances": [0.7, 0.5, 0.2],
        "sensor_x_m": 4.0,
        "sensor_room_depth_m": 2.7,
        "sensor_workplane_height_m": 0.75,
        "daylight_penetration_depth_m": 5.4,
        "daylight_area_m2": 43.2,
        "illuminance_setpoint_lux": 500.0,
        "switching_hysteresis_lux": 250.0,
        "presence_correction_factor": 1.0,
        "constant_light_area_m2": 4.8,
        "lighting_control_types": [1, 2, 3, 4, 5, 6],
        "glazing_type": "SGG Planitherm XN_4/14/4/14/4",
        "glazing_g_value": 0.545,
        "glazing_u_w_m2k": 0.654,
        "glazing_visible_transmittance": 0.742,
        "glazing_visible_reflectance": 0.145,
        "external_shading_activation_w_m2": 150.0
      },
      "variant_matrix": {
        "3A": ["shade_type_1", "lighting_type_1"],
        "3B": ["shade_type_1", "lighting_type_2"],
        "3C": ["shade_type_1", "lighting_type_3"],
        "3D": ["shade_type_1", "lighting_type_4"],
        "3E": ["shade_type_1", "lighting_type_5"],
        "3F": ["shade_type_1", "lighting_type_6"],
        "3G": ["shade_type_2", "lighting_type_1"],
        "3H": ["shade_type_2", "lighting_type_3"],
        "3I": ["shade_type_3", "lighting_type_1"],
        "3J": ["shade_type_3", "lighting_type_3"],
        "3K": ["shade_type_4", "lighting_type_1"],
        "3L": ["shade_type_4", "lighting_type_3"]
      },
      "required_results": ["hourly total whole-room lighting power in kW"],
      "mandatory_criteria": [
        "annual sum within the official reference-program band",
        "hourly frequency distribution within the official reference-program scatter band"
      ],
      "unresolved_dependencies": [
        "ISO EN 52016:2017 Chapter 7 complete test-room input set",
        "SIA 2024:2021 exact schedules",
        "SIA 387/4:2017 Tables 9 and 10 exact shading and lighting algorithms",
        "Example-building fabric-awning detail",
        "SIA authority clarification of the contradictory 3K/3L shade-device identity",
        "Qualified VE daylight sensor, dimming/switching and hourly APS bindings"
      ],
      "ve_generation_status": "NOT_IMPLEMENTED"
    },
    "4": {
      "variants": ["4"],
      "source": "SIA_4010_geteilter_Link/Test4/Spezifikation_Test4.pdf",
      "source_pages": [1, 2, 3],
      "confirmed_inputs": {
        "zone": "101 Hörsaal, windowless, double-height on floors 1 and 2, roof external",
        "net_area_m2": 165.81,
        "average_height_m": 6.38,
        "gross_volume_m3": 1058.0,
        "construction_reference": "FprSIA 380/2:2022 Table 3 limit values",
        "use_category": "SIA 2024:2021 Hörsaal, target values",
        "nominal_ventilation_m3_h_m2": 10.0,
        "infiltration_m3_h_m2": 0.15,
        "people_count": 55,
        "area_m2_per_person": 3.0,
        "activity_met": 1.2,
        "equipment_gain_w_m2": 10.0,
        "lighting_gain_w_m2": 6.4,
        "lighting_schedule": "07:00-18:00; off in July",
        "room_temperature_control": {
          "heating_lower_curve_c": [[19.0, 22.0], [23.5, 23.5]],
          "cooling_upper_curve_c": [[12.0, 23.0], [17.0, 25.0]],
          "independent_variable": "48-hour moving-mean outdoor temperature"
        },
        "co2_control_ppm": [600, 1000],
        "outdoor_co2_ppm": 400,
        "ahu_type": "single-zone variable-air-volume",
        "ahu_location": "roof, external climate",
        "ahu_leakage_class": "L1",
        "nominal_airflow_m3_h": 1700,
        "airflow_range_fraction": [0.2, 1.0],
        "operation_schedule": "weekdays 05:00-20:00; off in July",
        "supply_extract_pressure_pa": [500, 400],
        "supply_extract_fan_power_w": [407, 331],
        "supply_extract_fan_speed_rpm": [2790, 2730],
        "heat_recovery_type": "plate, no moisture recovery",
        "heat_recovery_temperature_effectiveness": 0.75,
        "heat_recovery_control": "supply-temperature bypass; 100% bypass in cooling",
        "frost_control": "bypass to exhaust-air temperature >= 0 C",
        "supply_air_temperature_ranges_c": {
          "cooling": [16.0, 22.5],
          "heating": [22.5, 29.0]
        },
        "cooling_coil_design_kw": 12.8,
        "cooling_coil_effectiveness": 0.85,
        "cooling_coil_bypass_factor": 0.065,
        "cooling_water_supply_c": 13.0,
        "heating_coil_design_kw": 11.4,
        "heating_water_supply_c": 40.0
      },
      "required_results": [